[
  {
    "id": "bullshooter-swiss-championship-2025",
    "title": "Bullshooter Schweizermeisterschaft",
    "date": "2025-02-09",
    "author": "Vorstand",
    "tags": ["Turnier", "Ankündigung"],
    "summary": "Der DC Farmer darf mit freuden die Schweizermeisterschaft vom Bullshooter mit dem Verband A.B.D.V.S. organisieren und durchführen. Diese wird in der Sporthalle Ortschwaben statt finden."
  }
]
